{
  "schemaVersion": 1,
  "caseId": "SSS-C2-CASE01",
  "curriculumVersion": "1.0",
  "status": "APPROVED_STABLE",
  "approvalDate": "2026-08-04",
  "owner": "Nate / Owner",
  "originalReleaseApprovalCommit": "864156f068cf89b595e1a394f1a4294c839f2876",
  "canonicalSourceApprovalCommit": "864156f068cf89b595e1a394f1a4294c839f2876",
  "sourceHashes": {
    "content": "af6143c46bc166be3420ce0d6243e615f49caaca7d679e587633a0e66e975e4c",
    "presentation": "9ba4fc5dffc501126032f8a06d1c21e17f5ea8fe914b0a0a885c377d0ccc3d05",
    "taskRegistry": "7d92bac95a3661a8ae4eaa2843e91b2ec4c59541b07234e8b4a8d888131788d1"
  },
  "rolePageCounts": {
    "student": 5,
    "teacher": 8,
    "answer": 4,
    "accessible": 8
  },
  "acceptedValidation": {
    "status": "PASS",
    "case01Scoped": "69/69",
    "case03Scoped": "54/54 (unchanged, byte-identical)",
    "static": "432/432",
    "browser": "1597/1597 across all 72 case/role/presentation states",
    "canonicalStructure": "PASS",
    "layoutContracts": "Accessible 11 eligible and 35 explicitly locked response areas; Student 11 eligible and 35 explicitly locked, across 9 registered cases",
    "authoringSecurity": "13/13",
    "fixedWorksheetGeometry": "816 x 1056 CSS-pixel Letter pages and 720 x 960 CSS-pixel frames PASS",
    "protectedPrintableComponents": "PASS",
    "pageCountsAndFit": "PASS; no page overflows in any role",
    "taskSeparation": "PASS; stacked Student tasks 3, 6 and 8 wrapped in task-block, gap profile matched against Campaign 2 Case 03 in-browser",
    "campaignScopedNavigation": "PASS; Campaign 2 lists Case 01 then Case 03 in case-number order",
    "accessibleDedicatedCER": "PASS",
    "accessibleDifferentiation": "67.7% word-sequence similarity to the Student edition, inside the 43-68% band set by the approved cases",
    "sourceBoundaryAndProhibitedClaims": "PASS; direction/magnitude, over-calibration, Earth-generalisation and guaranteed-remedy claims all mechanically blocked",
    "teachingAnalogyContainment": "PASS; merry-go-round values confined to the marked data-analogy block",
    "javascriptErrors": "0",
    "gitDiffCheck": "clean"
  },
  "acceptedPrintStatus": "PASS at 100% / Actual Size",
  "formerArtifacts": {
    "status": "NO_FORMER_GENERATED_ARTIFACTS",
    "reason": "Authored natively as a case package. No PDF, role document or screenshot was ever generated or tracked for this case."
  },
  "formerArtifactRecoveryCommit": "864156f068cf89b595e1a394f1a4294c839f2876",
  "recovery": "No artifact recovery applies. The canonical source at the approval commit is the whole release.",
  "priorApprovedReleases": [],
  "migrationNotes": [
    "First release of Campaign 2 Case 01, runtime case heavy_hands, the Vressk centrifuge habitat at Kepler-442b orbit.",
    "Frozen game baseline 29c3b222c53f51de11a3aa83e896a6d0ef6fb490, an approved species-tooltip presentation fix; campaign_2_data.js is byte-identical to the earlier 46b9387 baseline, so no case evidence changed.",
    "Registered as Campaign 2 Case 01 ahead of Case 03, which was produced first as the pilot. Case 03 keeps its runtime case number and was not renumbered; only its registry displayOrder moved from 8 to 9 so the Case menu lists Case 01 first.",
    "Learners meet the acceleration relationship through a labelled merry-go-round analogy rather than the habitat's own readings, which differ by less than a tenth of one percent across a 20 cm bed and cannot carry the idea at this reading level. The reported values are retained in the Teacher Guide.",
    "No mathematics standard is claimed: the packet requires no calculation."
  ],
  "retiredArtifacts": []
}
